{
  "$schema": "https://json-schema.org/draft/2020-12/schema",
  "title": "Digital Asset Outbound Requirement Matrix",
  "type": "object",
  "required": [
    "schema_version",
    "artifact_id",
    "artifact_version",
    "requirements",
    "decision_semantics"
  ],
  "properties": {
    "schema_version": {
      "type": "string",
      "const": "v1"
    },
    "artifact_id": {
      "type": "string"
    },
    "artifact_version": {
      "type": "string"
    },
    "scope": {
      "type": "string"
    },
    "fpg_role": {
      "type": "string"
    },
    "decision_semantics": {
      "type": "object"
    },
    "requirements": {
      "type": "array",
      "items": {
        "type": "object",
        "required": [
          "requirement_id",
          "legal_basis",
          "source",
          "required_fields",
          "transform",
          "destination",
          "required_exact",
          "evidence_type"
        ],
        "properties": {
          "requirement_id": {
            "type": "string"
          },
          "legal_basis": {
            "type": "string"
          },
          "trigger": {
            "type": "string"
          },
          "source": {
            "type": "string"
          },
          "required_fields": {
            "type": "array",
            "items": {
              "type": "string"
            }
          },
          "field_roles": {
            "type": "array",
            "items": {
              "type": "string"
            }
          },
          "transform": {
            "type": "array",
            "items": {
              "type": "string"
            }
          },
          "destination": {
            "type": "array",
            "items": {
              "type": "string"
            }
          },
          "required_exact": {
            "type": "boolean"
          },
          "validation": {
            "type": "string"
          },
          "on_missing": {
            "type": "string"
          },
          "on_mismatch": {
            "type": "string"
          },
          "audit": {
            "type": "string"
          },
          "effective_status": {
            "type": "string"
          },
          "evidence_type": {
            "type": "string"
          }
        },
        "additionalProperties": false
      }
    }
  },
  "additionalProperties": false
}
