{
  "schema_version": "v1",
  "artifact_id": "ORM-DA-REGULATED-TRANSFER-001",
  "artifact_version": "v1",
  "scope": "Digital Asset regulated outbound handoff requirement matrix",
  "fpg_role": "Policy Enforcement Gateway for already-approved transactions before external execution handoff.",
  "decision_semantics": {
    "PASS": "Current outbound handoff requirements are satisfied. This is not transaction approval.",
    "BLOCK": "The approved transaction may exist, but current outbound handoff requirements are not satisfied, so handoff stops.",
    "REVIEW": "Required internal/external information is missing, pending, unresolved, or ambiguous, so handoff is held."
  },
  "requirements": [
    {
      "requirement_id": "OR-DA-001",
      "legal_basis": "LAW_GO_KR::Act on Reporting and Using Specified Financial Transaction Information::Article 2::1-ha",
      "trigger": "regulated virtual asset transfer context",
      "source": "VASP_DIRECTORY_OR_PROVIDER|TRAVEL_RULE_PROVIDER",
      "required_fields": [
        "counterparty_vasp"
      ],
      "field_roles": [
        "REGULATORY_ATTRIBUTE",
        "DESTINATION_ATTRIBUTE"
      ],
      "transform": [
        "MAP_TO_EXTERNAL_SCHEMA",
        "SPLIT_INTERNAL_EXTERNAL"
      ],
      "destination": [
        "TRAVEL_RULE_PROVIDER",
        "EXTERNAL_VASP",
        "INTERNAL_AUDIT_ONLY"
      ],
      "required_exact": true,
      "validation": "Required input must be resolved before outbound handoff.",
      "on_missing": "REVIEW",
      "on_mismatch": "BLOCK for required exact approved/request mismatch; REVIEW when external status is pending.",
      "audit": "AUDIT_REQUIRED",
      "effective_status": "CURRENT",
      "evidence_type": "LEGAL_REQUIREMENT"
    },
    {
      "requirement_id": "OR-DA-002",
      "legal_basis": "LAW_GO_KR::Act on Reporting and Using Specified Financial Transaction Information::Article 5-2::1",
      "trigger": "before regulated transfer request is handed off",
      "source": "KYC_AML_SYSTEM",
      "required_fields": [
        "kyc_status"
      ],
      "field_roles": [
        "REGULATORY_ATTRIBUTE",
        "TRANSFORM_INPUT"
      ],
      "transform": [
        "OMIT"
      ],
      "destination": [
        "NOT_EXTERNALIZED",
        "INTERNAL_AUDIT_ONLY"
      ],
      "required_exact": true,
      "validation": "Required input must be resolved before outbound handoff.",
      "on_missing": "REVIEW",
      "on_mismatch": "BLOCK for required exact approved/request mismatch; REVIEW when external status is pending.",
      "audit": "AUDIT_REQUIRED",
      "effective_status": "CURRENT",
      "evidence_type": "LEGAL_REQUIREMENT"
    },
    {
      "requirement_id": "OR-DA-003",
      "legal_basis": "LAW_GO_KR::Act on Reporting and Using Specified Financial Transaction Information::Article 5-3::1",
      "trigger": "required customer verification is not satisfied",
      "source": "KYC_AML_SYSTEM",
      "required_fields": [
        "kyc_status"
      ],
      "field_roles": [
        "REGULATORY_ATTRIBUTE",
        "TRANSFORM_INPUT"
      ],
      "transform": [
        "OMIT"
      ],
      "destination": [
        "NOT_EXTERNALIZED",
        "INTERNAL_AUDIT_ONLY"
      ],
      "required_exact": true,
      "validation": "Required input must be resolved before outbound handoff.",
      "on_missing": "BLOCK",
      "on_mismatch": "BLOCK for required exact approved/request mismatch; REVIEW when external status is pending.",
      "audit": "AUDIT_REQUIRED",
      "effective_status": "CURRENT",
      "evidence_type": "LEGAL_REQUIREMENT"
    },
    {
      "requirement_id": "OR-DA-004",
      "legal_basis": "LAW_GO_KR::Enforcement Decree of Act on Reporting and Using Specified Financial Transaction Information::Article 10-10::1",
      "trigger": "virtual asset transfer between VASPs",
      "source": "INTERNAL_CUSTOMER_MASTER",
      "required_fields": [
        "originator_identity"
      ],
      "field_roles": [
        "REGULATORY_ATTRIBUTE",
        "OUTBOUND_PAYLOAD_FIELD"
      ],
      "transform": [
        "MINIMIZE",
        "MAP_TO_EXTERNAL_SCHEMA"
      ],
      "destination": [
        "TRAVEL_RULE_PROVIDER",
        "EXTERNAL_VASP"
      ],
      "required_exact": true,
      "validation": "Required input must be resolved before outbound handoff.",
      "on_missing": "REVIEW",
      "on_mismatch": "BLOCK for required exact approved/request mismatch; REVIEW when external status is pending.",
      "audit": "AUDIT_REQUIRED",
      "effective_status": "CURRENT",
      "evidence_type": "LEGAL_REQUIREMENT"
    },
    {
      "requirement_id": "OR-DA-005",
      "legal_basis": "LAW_GO_KR::Enforcement Decree of Act on Reporting and Using Specified Financial Transaction Information::Article 10-10::1",
      "trigger": "virtual asset transfer between VASPs",
      "source": "INTERNAL_CUSTOMER_MASTER|TRAVEL_RULE_PROVIDER",
      "required_fields": [
        "beneficiary_identity"
      ],
      "field_roles": [
        "REGULATORY_ATTRIBUTE",
        "OUTBOUND_PAYLOAD_FIELD"
      ],
      "transform": [
        "MINIMIZE",
        "MAP_TO_EXTERNAL_SCHEMA"
      ],
      "destination": [
        "TRAVEL_RULE_PROVIDER",
        "EXTERNAL_VASP"
      ],
      "required_exact": true,
      "validation": "Required input must be resolved before outbound handoff.",
      "on_missing": "REVIEW",
      "on_mismatch": "BLOCK for required exact approved/request mismatch; REVIEW when external status is pending.",
      "audit": "AUDIT_REQUIRED",
      "effective_status": "CURRENT",
      "evidence_type": "LEGAL_REQUIREMENT"
    },
    {
      "requirement_id": "OR-DA-006",
      "legal_basis": "KOFIU::KoFIU AML/CDD virtual asset guidance::Travel Rule guidance::originator-beneficiary information",
      "trigger": "travel-rule applicable transfer",
      "source": "APPROVED_TRANSACTION|BLOCKCHAIN_EXECUTION_LAYER",
      "required_fields": [
        "transaction_id"
      ],
      "field_roles": [
        "TRACE_FIELD",
        "OUTBOUND_PAYLOAD_FIELD"
      ],
      "transform": [
        "PASS_THROUGH"
      ],
      "destination": [
        "TRAVEL_RULE_PROVIDER",
        "INTERNAL_RECONCILIATION_ONLY"
      ],
      "required_exact": true,
      "validation": "Required input must be resolved before outbound handoff.",
      "on_missing": "REVIEW",
      "on_mismatch": "BLOCK for required exact approved/request mismatch; REVIEW when external status is pending.",
      "audit": "AUDIT_REQUIRED",
      "effective_status": "CURRENT",
      "evidence_type": "LEGAL_REQUIREMENT"
    },
    {
      "requirement_id": "OR-DA-007",
      "legal_basis": "LAW_GO_KR::Virtual Asset User Protection Act::Article 9::1",
      "trigger": "after virtual asset transaction",
      "source": "EXTERNAL_EXECUTION_RESPONSE",
      "required_fields": [
        "execution_status"
      ],
      "field_roles": [
        "EXECUTION_RESULT_FIELD",
        "TRACE_FIELD"
      ],
      "transform": [
        "PASS_THROUGH"
      ],
      "destination": [
        "INTERNAL_RECONCILIATION_ONLY",
        "INTERNAL_AUDIT_ONLY"
      ],
      "required_exact": true,
      "validation": "Required input must be resolved before outbound handoff.",
      "on_missing": "BLOCK",
      "on_mismatch": "BLOCK for required exact approved/request mismatch; REVIEW when external status is pending.",
      "audit": "AUDIT_REQUIRED",
      "effective_status": "CURRENT",
      "evidence_type": "LEGAL_REQUIREMENT"
    },
    {
      "requirement_id": "OR-DA-008",
      "legal_basis": "FATF::FATF Recommendation 15 Interpretive Note::INR.15::7(b)",
      "trigger": "virtual asset transfer",
      "source": "INTERNAL_CUSTOMER_MASTER",
      "required_fields": [
        "originator_identity"
      ],
      "field_roles": [
        "REGULATORY_ATTRIBUTE",
        "OUTBOUND_PAYLOAD_FIELD"
      ],
      "transform": [
        "MINIMIZE",
        "MAP_TO_EXTERNAL_SCHEMA"
      ],
      "destination": [
        "TRAVEL_RULE_PROVIDER",
        "EXTERNAL_VASP"
      ],
      "required_exact": true,
      "validation": "Required input must be resolved before outbound handoff.",
      "on_missing": "REVIEW",
      "on_mismatch": "BLOCK for required exact approved/request mismatch; REVIEW when external status is pending.",
      "audit": "AUDIT_REQUIRED",
      "effective_status": "CURRENT",
      "evidence_type": "LEGAL_REQUIREMENT"
    },
    {
      "requirement_id": "OR-DA-009",
      "legal_basis": "FATF::FATF Recommendation 15 Interpretive Note::INR.15::7(b)",
      "trigger": "virtual asset transfer",
      "source": "INTERNAL_CUSTOMER_MASTER|TRAVEL_RULE_PROVIDER",
      "required_fields": [
        "beneficiary_identity"
      ],
      "field_roles": [
        "REGULATORY_ATTRIBUTE",
        "OUTBOUND_PAYLOAD_FIELD"
      ],
      "transform": [
        "MINIMIZE",
        "MAP_TO_EXTERNAL_SCHEMA"
      ],
      "destination": [
        "TRAVEL_RULE_PROVIDER",
        "EXTERNAL_VASP"
      ],
      "required_exact": true,
      "validation": "Required input must be resolved before outbound handoff.",
      "on_missing": "REVIEW",
      "on_mismatch": "BLOCK for required exact approved/request mismatch; REVIEW when external status is pending.",
      "audit": "AUDIT_REQUIRED",
      "effective_status": "CURRENT",
      "evidence_type": "LEGAL_REQUIREMENT"
    },
    {
      "requirement_id": "OR-DA-010",
      "legal_basis": "FATF::FATF Recommendations::Recommendation 16::payment transparency",
      "trigger": "transfer transparency requirement applies",
      "source": "APPROVED_TRANSACTION|BLOCKCHAIN_EXECUTION_LAYER",
      "required_fields": [
        "transaction_id"
      ],
      "field_roles": [
        "TRACE_FIELD",
        "OUTBOUND_PAYLOAD_FIELD"
      ],
      "transform": [
        "PASS_THROUGH"
      ],
      "destination": [
        "TRAVEL_RULE_PROVIDER",
        "INTERNAL_RECONCILIATION_ONLY"
      ],
      "required_exact": true,